ingredient_name,rating,functions,benefits
Naringenin,BEST,Antioxidant that improves skin’s innate ability to repair itself and maintain a youthful look. Helps soothes compromised skin.,"Anti-Aging, Hydration, Soothing"
Naringin,BEST,A plant-derived antioxidant compound that’s proven to help skin withstand environmental exposure so it can look younger and healthier.,Anti-Aging
Natural Moisturizing Factor (NMF),BEST,One of the primary elements in keeping skin feeling and looking healthier.,Hydration
Neem Extract,BEST,Neem extract has antioxidant and skin-calming benefits and may also help reduce the population of harmful microbes on skin's surface.,
N-Hydroxysuccinimide,BEST,"Synthetic ingredient which softens and conditions skin. It also serves as a reagent, meaning it can trigger a reaction that leads to a new substance, such as peptides and polymers.",Hydration
Niacin,BEST,"This acid is one of two types of vitamin B3, the other being niacinamide.","Anti-Aging, Hydration"
Niacinamide,BEST,"Helps visibly minimize pore size, improve dull/uneven tone, and reduce wrinkle depth. Also known to fortify skin's barrier strength and boost hydration.","Anti-Aging, Pore Minimizer, Soothing"
Nicotinamide,BEST,"This anti-aging, pore minimizing ingredient is better known as niacinamide or vitamin B3.","Anti-Aging, Pore Minimizer, Soothing"
Nicotinic Acid,BEST,"This acid is one of two types of vitamin B3, the other being niacinamide.","Anti-Aging, Pore Minimizer, Soothing"
Nordihydroguaiaretic Acid,BEST,Powerful antioxidant that stands out for its ability to help defend skin against daily environmental stressors and mitigate visible effects of UV exposure. Can be naturally or synthetically derived.,Anti-Aging
Nymphaea Tetragona,BEST,Also known as pygmy waterlily. The stem has been shown to be an antioxidant.,
Nymphaea Tetragona Extract,BEST,Also known as pygmy waterlily. The stem has been shown to be an antioxidant.,
Oat Beta-Glucan,BEST,Soothing ingredient derived from oats that is proven to visibly calm skin and reduce signs of sensitivity + redness. Also offers moisturizing and anti-aging properties.,"Soothing, Hydration"
Oat Bran Extract,BEST,Oat bran extract is a portion of the oat plant that contains antioxidant and soothing properties.,Soothing
Oat Kernel Extract,BEST,This plant-derived ingredient is well-known for both its antioxidant and skin-soothing properties.,Soothing
Oatmeal,BEST,Can have skin-soothing properties.,Soothing
Octinoxate,BEST,Octinoxate ranks among the most frequently used UV filters and is approved around the world. It excels in the UVB range but also offers some UVA protection.,Anti-Aging
Octisalate,BEST,A synthetic UV filter that works primarily in the UVB range but can also contribute some UVA protection.,Anti-Aging
Octocrylene,BEST,"Primarily a UVB filter, octocrylene is also used to improve UVA protection and help stabilize other UV filters, especially avobenzone.",Anti-Aging
Octyl Methoxycinnamate,BEST,Sunscreen agent used to protect skin primarily from the sun's UVB rays.,Anti-Aging
Octyl Salicylate,BEST,Sunscreen agent used to protect skin primarily from the sun's UVB rays.,Anti-Aging
Oenothera Biennis Oil,BEST,Non-fragrant plant oil whose fatty acids can have significant skin-soothing and emollient benefits.,"Hydration, Anti-Aging, Soothing"
Olea Europaea Leaf Extract,BEST,"This extract from the leaves of the olive plant has strong anti-aging benefits, including antioxidant and photoprotective abilities.",Anti-Aging
Olea Europaea Oil Unsaponifiables,BEST,An unsaponifiable oil is the portion of a plant oil that is not broken down when the oil's fatty acids are refined for use in cosmetics products.,"Anti-Aging, Hydration, Soothing"
Oleanolic Acid,BEST,This natural ingredient functions as a potent skin soother and has value as an antioxidant.,Soothing
Oleic Acid,BEST,Omega-9 fatty acid used as a cleansing agent and texture enhancer. Its skin calming properties are boosted when combined with other fats in skin care.,
Oleyl Adapalenate,BEST,"A synthetic precursor to the retinoid adapalene, used to help smooth skin texture, soften lines, and reduce the look of pores + blemishes.","Anti-Aging, Evens Skin Tone, Oil Control, Pore Minimizer, Soothing"
Ophiopogon Japonicus Root Extract,BEST,"The root of this plant contains several beneficial compounds that have antioxidant, soothing, and redness-reducing properties.",
Opuntia Ficus-Indica Stem Extract,BEST,A type of cactus also known as prickly pear whose stem is a bountiful source of antioxidant compounds known as polyphenols.,Anti-Aging
Orbignya Martiana,BEST,"A rich source of the medium chain triglyceride lauric acid, which comprises over 50% of the fatty acids found in this plants oil.",Hydration
Orbignya Martiana Seed Oil,BEST,"A rich source of the medium chain triglyceride lauric acid, which comprises over 50% of the oil’s fatty acids.",Hydration
Orbignya Oleifera Seed Oil,BEST,"Commonly known as babassu oil, this non-fragrant nut oil smooths and softens skin, plus it's a good antioxidant.","Hydration, Anti-Aging"
Oryzanol,BEST,"Component of plants and their products, such as rice bran, that has potent antioxidant properties.",Anti-Aging
Oryza Sativa (Rice) Bran Extract,BEST,"The brown part of the rice kernel, this ingredient helps soften and condition skin and is a source of more than 100 antioxidant compounds.",Hydration
Oryza Sativa (Rice) Bran Oil,BEST,This oil extracted from rice is a rich source of antioxidants + fatty acids and helps improve the look of discolorations.,Hydration
Oryza Sativa Cera,BEST,"A natural, non-fragrant wax obtained from rice bran. It functions as a skin-softening agent.",Hydration
Oryza Sativa Rice Bran Oil,BEST,This oil extracted from rice is a rich source of antioxidants + fatty acids and helps improve the look of discolorations.,"Anti-Aging, Hydration"
Oxidoreductase,BEST,Large group of enzymes that block oxygen in different forms from generating environmental damage.,"Anti-Aging, Hydration"
P. Elisabethae,BEST,"The ""P."" is short for the genus Pseudopterogorgia.",Soothing
Palmitoyl Dipeptide-10,BEST,"A synthetic peptide whose lipid (fat) component enables skin surface penetration, where it works as an antioxidant to neutralize collagen-degrading enzymes.",Anti-Aging
Palmitoyl Dipeptide-5 Diaminobutyroyl Hydroxythreonine,BEST,A synthetic peptide that helps visibly firm skin by supporting key collagens and other proteins that play a role in maintaining skin’s natural architecture.,Anti-Aging
Palmitoyl Hexapeptide-12,BEST,"This lab-made peptide matches a sequence of amino acids found in skin. As such, skin recognizes and can understand the signals the peptide sends, which leads to a smoother, more youthful appearance.",Anti-Aging
Palmitoyl Oligopeptide,BEST,A blend of palmitic acid (a fatty acid) with several amino acids.,Anti-Aging
Palmitoyl Pentapeptide-4,BEST,"Trade name Matrixyl, a fatty acid mixed with amino acids.",Anti-Aging
Palmitoyl Proline,BEST,Palmitoyl proline combines fatty acid palmitic acid with the amino acid proline.,Hydration
Palmitoyl Tetrapeptide-7,BEST,"This peptide blends four amino acids with a fatty acid to enhance penetration, where it goes to work quieting factors in skin that trigger irritation and damage to skin’s supportive elements.",Anti-Aging
Palmitoyl Tetrapeptide-72 Amide,BEST,"A synthetic peptide that acts on numerous supportive elements in skin, helping to maintain a firmer, tighter look and feel.",Anti-Aging
Palmitoyl Tripeptide-1,BEST,Synthetic peptide proven to strengthen skin’s underlying supportive elements and visibly reduce signs of sun damage such as wrinkles and rough texture.,Anti-Aging
Palmitoyl Tripeptide-38,BEST,This synthetic peptide helps improve the appearance of fine lines and wrinkles. It also minimizes the look of uneven tone and dullness.,Anti-Aging
Palmitoyl Tripeptide-5,BEST,"Anti-aging peptide proven to visibly impact wrinkles, firmness, and rough texture for smoother, younger-looking skin.",Anti-Aging
Palmitoyl Tripeptide-8,BEST,A plant-derived or synthetic peptide made from combining the fatty acid palmitic acid with tripeptide-8.,Anti-Aging
Palm Oil,BEST,Has emollient and antioxidant properties for skin.,"Hydration, Anti-Aging"
Panax Ginseng Root Extract,BEST,"Ginseng is a popular herbal supplement. When applied topically it delivers antioxidant benefits, boosts hydration, and helps visibly improve signs of skin aging.",Anti-Aging
Pantethine,BEST,Also known as pantothenic acid.,Hydration
Panthenol,BEST,Also known as pro-vitamin B5. Humectant that increases hydration substantially by attracting/retaining moisture. Can also play a role in visibly reducing facial redness triggered by sensitivity.,"Hydration, Soothing"
Pantothenic Acid,BEST,"Also called vitamin B5, and often touted for a variety of benefits to skin.","Hydration, Soothing"
Parsol 1789,BEST,UVA-only sunscreen filter that must be combined with other sunscreen ingredients to achieve broad-spectrum protection.,Anti-Aging
Passiflora Edulis Seed Oil,BEST,"Non-fragrant plant oil from the passion fruit plant, and a rich source of fatty acids and antioxidants.","Anti-Aging, Hydration"
Pelvetia Canaliculata (Algae) Extract,BEST,"This type of seaweed exerts antioxidant, soothing, and hydrating effects on skin.","Anti-Aging, Hydration"
Pelvetia Canaliculata Extract,BEST,"This type of seaweed exerts antioxidant, soothing, and hydrating effects on skin.","Anti-Acne, Hydration"
Pentapeptide-59,BEST,Pentapeptide-59 is a biomimetic peptide that contains amino acids.,"Anti-Aging, Soothing"
Pentapeptides,BEST,"Pentapeptides are a type of peptide where the peptide has five (""penta"") amino acids. There are dozens of pentapeptides used in cosmetic products.",Anti-Aging
Peptides,BEST,"Peptides are portions of short or long-chain amino acids, and amino acids are the building blocks of protein.",
Persea Gratissima (Avocado) Oil,BEST,"The Latin name for avocado, the oil from this fruit is an excellent source of skin-replenishing fatty acids.","Hydration, Anti-Aging, Soothing"
Persea Gratissima (Avocado) Oil,BEST,"Persea gratisima is the Latin name for avocado, and the oil from this fruit is an excellent source of skin-replenishing fatty acids","Hydration, Anti-Aging, Soothing"
Persicaria Hydropiper,BEST,Also known as water pepper.,"Anti-Aging, Soothing, Hydration"
Persicaria Hydropiper Extract,BEST,Also known as water pepper.,"Anti-Aging, Soothing, Hydration"
Petrolatum,BEST,Widely considered one of the best and gentlest options for dry skin so it's often used in moisturizers and balms. It is highly purified and is safe as used in cosmetics.,"Hydration, Soothing"
Peucedanum Graveolens (Dill) Extract,BEST,"A plant extract that serves as an antioxidant. It visibly calms and firms skin, plus it’s a rich source of iron, potassium, and beta-carotene.","Anti-Aging, Soothing"
PHA,BEST,Ingredients such as gluconolactone and lactobionic acid are types of PHA.,"Anti-Aging, Evens Skin Tone, Smooths Bumpy Skin"
Phloretin,BEST,A flavonoid substance derived from apples and the bark of apple trees.,"Anti-Aging, Evens Skin Tone"
Phosphatidylcholine,BEST,Active ingredient in lecithin.,Hydration
Phosphatidylethanolamine,BEST,This type of phospholipid provides hydrating and potential dark spot fading benefits to skin.,"Hydration, Dark Spot Fading"
Phospholipid,BEST,"A type of fat found naturally in skin, these ingredients have value in skin care for their ability to both attract water and deliver it to areas that need increased hydration. They also have antioxidant properties.",Hydration
Phospholipids,BEST,"A type of fat found naturally in skin, these ingredients have value in skin care for their ability to both attract water and deliver it to areas that need increased hydration. They also have antioxidant properties.",Hydration
Phycocyanin,BEST,"Algae extract that delivers anti-aging antioxidant benefits, as well as skin-soothing properties.","Soothing, Anti-Aging"
Phyllanthus Emblica Fruit Extract,BEST,Extract that has antioxidant and soothing properties.,"Anti-Aging, Soothing"
Physalis Angulata Extract,BEST,This plant extract has a potent calming effect on skin.,"Anti-Aging, Soothing"
Phytoceramides,BEST,Phytoceramides are plant-derived ceramides.,"Anti-Aging, Hydration"
Phytosphingosine,BEST,"This fatty acid is found naturally in the upper layers of skin and helps it retain its natural moisturizing factor (NMF), which benefits skin health. It also has calming properties.","Anti-Aging, Hydration"
Phytosphingosine Phosphate,BEST,Phytosphingosine phosphate is a large mix of esters derived from phytosphingosine and phosphoric acid.,"Anti-Aging, Hydration"
Phytosterols,BEST,"Phytosterols are naturally occurring, cholesterol-like molecules found in all plant foods.","Hydration, Soothing"
Phytosteryl/Octyldodecyl Lauroyl Glutamate,BEST,"Phytosteryl/octyldodecyl lauroyl glutamate, a mix of amino acids and plant-based sterols, functions in cosmetics as an emollient and skin-conditioner.",Hydration
Picea Abies Wood Extract,BEST,"Wood extract derived from Norway spruce, known for its skin-soothing properties. Can be upcycled as a byproduct of the timber industry.",Soothing
Pisum Sativum (Pea) Extract,BEST,Extract derived from the garden pea that offers antioxidant and skin-conditioning benefits. Can help reduce factors within skin that lead to redness and other signs of sensitivity.,"Anti-Aging, Soothing"
Plinia Cauliflora (Jabuticaba) Fruit Extract,BEST,"Jabuticaba is a dark berry native to Brazil and, like many berries, is a rich source of nearly a dozen polyphenolic antioxidants.",Anti-Aging
Plinia Cauliflora Fruit Extract,BEST,"This dark berry is native to Brazil and, like many berries, is a rich source of nearly a dozen polyphenolic antioxidants.",Anti-Aging
Plukenetia Volubilis Seed Oil,BEST,"Fragrance-free plant oil that offers skin-nourishing fatty acids, anti-aging antioxidants and moisturizing benefits.","Anti-Aging, Hydration, Soothing"
Plum Seed Oil,BEST,"Plum (Prunus domestica) seed oil, also known as plum kernel oil, is non-fragrant oil.","Anti-Aging, Hydration"
Polyglutamic Acid,BEST,"Established humectant available in a range of molecular sizes, including those capable of penetrating skin’s surface for long-lasting moisture retention.","Hydration, Anti-Aging"
Polyglyceryl-3 Rice Branate,BEST,An ingredient that serves as a surfactant and emulsifier and is a derivative of the fatty acids that come from rice bran oil.,Hydration
Polyglyceryl-4 Olivate,BEST,"Multitalented ingredient that can work as an emulsifier, stabilizer, emollient, and cleansing agent. The olive oil portion of this ingredient is a beneficial source of fatty acids and antioxidants.",
Polygonum Bistorta Root Extract,BEST,"Plant extract that’s a potent antioxidant and able to revive a radiant, even-toned look to dull, fatigued skin.","Anti-Aging, Evens Skin Tone, Hydration, Soothing"
Polygonum Cuspidatum Root Extract,BEST,"Plant extract that’s an excellent source of trans-resveratrol, the form skin can readily use. It has particular value for helping to preserve skin’s youthfulness.","Anti-Aging, Soothing"
Polyhydroxy Acid,BEST,Ingredients such as gluconolactone and lactobionic acid are types of polyhydroxy acid (PHA).,"Evens Skin Tone, Smooths Bumpy Skin, Anti-Aging"
Polysaccharide,BEST,Natural component of skin that can be a good water-binding agent and potentially have antioxidant properties.,"Hydration, Anti-Aging"
Pomegranate Extract,BEST,Antioxidant-rich plant extract that can help improve the appearance of aging skin by inhibiting damaging environmental stressors. It can also have a soothing effect on skin.,"Anti-Aging, Soothing"
Pongamia Glabra Seed Oil,BEST,"Oil derived from the seeds of the Millettia pinnata tree, a plant native to South and Southeast Asia.","Anti-Aging, Hydration"
Poria Cocos Extract,BEST,"Also known as Hoelen and Fu ling. Extract derived from a mushroom, which has antioxidant and skin-soothing properties.","Anti-Aging, Soothing"
Porphyra Umbilicalis Extract,BEST,Latin name for a type of red algae that’s proven to help defend skin from environmental stressors and has great synergy with vitamin C.,"Anti-Aging, Hydration, Soothing"
Portulaca Oleracea Extract,BEST,"Potent antioxidant with skin-soothing, anti-wrinkle benefits. Also delivers beneficial minerals for skin. Has the potential to help skin that has become lax/crepey.","Anti-Aging, Soothing, Hydration"
Portulaca Pilosa Extract,BEST,"Natural ingredient that's a rich source of potent, effective antioxidants skin needs to look and act younger. Also contains hydrating saccharides.",
Potassium Ascorbyl Tocopheryl Phosphate,BEST,Blend of vitamins C and E with phosphorus that functions as an antioxidant.,Anti-Aging
Potassium Azeloyl Diglycinate,BEST,"A derivative of azelaic acid, this multitasker that improves uneven tone, soothes skin, and balances oil production while also hydrating skin.","Evens Skin Tone, Soothing, Dark Spot Fading"
Potassium PCA,BEST,"Skin-replenishing mineral electrolyte that helps improve hydration levels, while strengthening skin's barrier. Also helps optimize skin’s desquamation (shedding) process.",Hydration
Prickly Pear,BEST,Unknown,"Anti-Aging, Soothing, Smooths Bumpy Skin"
Proline,BEST,This amino acid helps skin retain moisture and supports the structures in skin that keep it looking and feeling youthful.,"Hydration, Anti-Aging"
Propyl Gallate,BEST,Antioxidant that benefits skin while promoting formulary stability.,
Protease,BEST,This type of enzyme can work to help renew skin and help restore its barrier.,Anti-Aging
Prunus Amygdalus Dulcis (Sweet Almond) Oil,BEST,"This non-fragrant plant oil has numerous benefits for skin, including as a source of triglycerides, fatty acids, and antioxidants.","Anti-Aging, Hydration"
Prunus Armeniaca,BEST,"Latin name for apricot and also known as Armenian plum. Use in cosmetics depends on the part used: oil, extract, water/juice, leaf, seed, or shell.",Anti-Aging
Prunus Armeniaca (Apricot) Fruit,BEST,"Latin name for apricot and also known as Armenian plum. Use in cosmetics depends on the part used: oil, extract, water/juice, leaf, seed, or shell.",Anti-Aging
Prunus Armeniaca (Apricot) Kernel Oil,BEST,This non-fragrant plant oil has hydrating properties and is a rich source of fatty acids and antioxidants.,"Anti-Aging, Hydration"
Prunus Domestica Seed Oil,BEST,"Non-fragrant plant oil, more commonly known as plum (and, when dried, prune) that is a rich source of several potent antioxidants.","Hydration, Anti-Aging"
Prunus Lannesiana (Cherry Blossom) Flower Extract,BEST,Extract from a flowering plant that contains beneficial antioxidant components that help skin look younger and more even-toned.,"Anti-Aging, Soothing"
Prunus Serotina (Wild Cherry) Fruit Extract,BEST,"Commonly known as black cherry, wild cherry extract is a potent source of antioxidants, notably several kinds of antioxidants known as polyphenols.","Anti-Aging, Soothing"
Pseudopterogorgia Elisabethae,BEST,"Also known as sea whip, this ingredient is known for its soothing properties.",Soothing
Psidium Guajava Fruit Extract,BEST,"Guava extract is a rich source of bioactive antioxidants including gallic acid, quercetin, and tocopherol.",Anti-Aging
Pueraria Lobata,BEST,"Commonly known as kudzu, this plant and its extracts are a source of isoflavone, genistein, and daidzein, all plant estrogens that can help improve signs of aging.","Anti-Aging, Evens Skin Tone"
Pueraria Lobata Root Extract,BEST,"Source of isoflavone, genistein, and daidzein, all plant estrogens that provide anti-aging and antioxidant benefits.","Anti-Aging, Evens Skin Tone"
Pumpkin,BEST,Plant whose seeds are a rich source of fatty acids and several antioxidant components.,"Anti-Aging, Hydration"
Pumpkin Seed Extract,BEST,Type of squash that is a very good source of antioxidant cartenoids.,"Anti-Aging, Hydration"
Punica Granatum Extract,BEST,"Commonly known as pomegranate, this antioxidant can help improve the appearance of aging skin by inhibiting damaging environmental stressors. It can also have a soothing effect on skin.","Anti-Aging, Soothing"
Punica Granatum Fruit Extract,BEST,"This ingredient, also known as pomegranate fruit extract, has antioxidant and anti-wrinkle properties for skin.","Anti-Aging, Soothing"
Punica Granatum Pericarp Extract,BEST,"Alternative name for pomegranate peel, which like other parts of this fruit is a rich source of antioxidants for healthier skin.","Anti-Aging, Hydration, Soothing"
Punica Granatum Seed Oil,BEST,"Also known as pomegranate seed oil, this a non-fragrant oil delivers skin-soothing and restorative effects. Its beneficial compounds include fatty acids, antioxidants, and phytoestrogens.","Anti-Aging, Hydration, Soothing"
Purslane,BEST,"Potent antioxidant with skin-soothing, anti-wrinkle benefits. Also delivers beneficial minerals for skin. Has the potential to help skin that has become lax/crepey.","Anti-Aging, Soothing"
Pycnogenol,BEST,Antioxidant derived from the bark of the French Maritime pine tree.,"Anti-Aging, Soothing"
Pyrus Malus (Apple) Fruit Extract,BEST,This fruit extract is a rich source of free radical-scavenging antioxidants and has hydrating properties.,"Anti-Aging, Hydration"
Quercetin,BEST,"A natural ingredient found in a wide variety of plants, including tomatoes, kale, and berries. In skin care, it serves as an antioxidant, soothing, and restorative ingredient.","Anti-Aging, Soothing"
Rambutan,BEST,Extract derived from a tropical fruit (rambutan). Offers significant anti-aging benefits & helps protect against photo-aging (sun damage).,"Anti-Aging, Dark Spot Fading, Soothing"
Rapeseed Oil,BEST,Nonfragrant oil that has emollient and potential antioxidant properties for skin and is a rich source of omega-3 and omega-6 fatty acids.,"Hydration, Anti-Aging"
Raphanus Sativus (Radish) Seed Oil,BEST,Raphanus sativus (radish) seed oil is non-fragrant plant oil that's a rich source of unsaturated fatty acids.,"Hydration, Anti-Aging"
Red Algae,BEST,This type of seaweed has hydrating and antioxidant benefits for skin.,
Rehmannia Glutinosa Root Extract,BEST,This extract used in traditional Chinese medicine has calming and anti-aging properties for skin.,"Anti-Acne, Soothing"
Resveratrol,BEST,"Soothing antioxidant with the power to help minimize discolorations, while rebuffing other signs of aging.","Anti-Aging, Dark Spot Fading, Soothing"
Retinaldehyde,BEST,"Form of retinol that is a direct precursor to retinoic acid, with significant research backing its ability to visibly reduce fine lines, wrinkles, and other signs of aging. Can also be used to improve the appearance of blemish-prone skin.","Anti-Aging, Evens Skin Tone, Oil Control"
Retinoids,BEST,"An umbrella term for vitamin A derivatives that work as antioxidants and promote anti-aging, firming, skin tone evening and pore-minimizing benefits.",
Retinol,BEST,"One of the most recognized anti-aging ingredients, this powerhouse has multiple benefits for skin. With over seven decades of research proving its effectiveness, it’s used in several strengths and types of products to deliver visible results.","Anti-Aging, Anti-Acne, Pore Minimizer"
Retinyl Ascorbate,BEST,An ester of vitamin A (retinoic acid) and vitamin C (ascorbic acid) that functions as an antioxidant...,"Anti-Aging, Anti-Acne, Pore Minimizer"
Retinyl Palmitate,BEST,A form of vitamin A that’s found naturally in skin and works in cosmetics as an antioxidant. It has been ruled as safe as used in cosmetics.,Anti-Aging
Retinyl Propionate,BEST,Retinyl propionate is a vitamin A derivative that shares the same anti-aging benefits as classic retinol but with greater stability.,"Anti-Acne, Anti-Aging, Dark Spot Fading, Evens Skin Tone, Pore Minimizer"
Retinyl Retinoate,BEST,"A synthetic, ""new generation"" retinol with research showing its usefulness for restoring and improving signs of aging in skin.","Anti-Aging, Anti-Acne, Pore Minimizer"
Rhamnose,BEST,"Naturally-derived prebiotic sugar that provides skin-soothing, hydrating, and anti-aging benefits.","Anti-Aging, Soothing"
Rhodiola Rosea Root Extract,BEST,"The extract of the plant Rhodiola rosea, also known as Arctic root or golden root, that is high in antioxidants and flavonoids.",Anti-Acne
Ricinus Communis (Castor) Seed Oil,BEST,"Emollient oil derived from the castor bean, which is rich in skin-beneficial fatty acids.",Hydration
Rosa Canina,BEST,Plant with potential antioxidant (anti-aging) benefits for skin.,Anti-Aging
Rosa Canina Fruit Oil,BEST,"Non-fragrant, emollient plant oil (commonly referred to as rose hip) that offers antioxidant properties and is a rich source of skin-beneficial fatty acids.","Hydration, Anti-Aging"
Rosa Canina Seed Extract,BEST,Plant extract with potential antioxidant (anti-aging) benefits for skin.,Anti-Aging
Rosa canina seed oil,BEST,Non-fragrant plant oil that works to hydrate and protect skin from aging environmental aggressors.,"Hydration, Anti-Aging"
Rosa Moschata Leaf Extract,BEST,This extract comes from the leaves of one of the plants that produces rose hips used for rose hip oil.,
Rosa Moschata Seed Oil,BEST,"Non-fragrant, emollient plant oil (commonly known as rose hip) that offers antioxidant properties and is a rich source of skin-beneficial fatty acids.","Hydration, Anti-Aging"
Rosa Mosqueta,BEST,"The Latin name for one of the sources of rose hip oil, a rich source of skin-beneficial fatty acids.",
Rosa Multiflora Fruit Extract,BEST,This plant extract is the fruit of the Japanese rose and has antioxidant plus  anti-aging capabilities.,Anti-Aging
Rosa Roxburghii Extract,BEST,Extract from the chestnut rose; can be a source of antioxidants for skin.,Anti-Aging
Rosa Rubiginosa,BEST,A species of rose hip that can provide antioxidant properties.,Anti-Aging
Rosa Rubiginosa Fruit Extract,BEST,Plant extract from a species of rose hip that can provide antioxidant properties.,Anti-Aging
