ingredient_name,rating,functions,benefits
Sodium Benzoate,GOOD,This preservative is used to prevent the growth of bacteria and fungi in cosmetics and food products. It’s derived from benzoic acid.,
Sodium Caproyl Methyltaurate,GOOD,This mild surfactant and cleansing agent has been ruled safe to use in cosmetics.,
Sodium Carbomer,GOOD,This blend of sodium (salt) and the gelling agent carbomer serves as a film-forming agent and stabilizer in cosmetics formulations. Carbomers have been ruled safe as used in skin care products.,
Sodium Carboxymethyl Beta-Glucan,GOOD,"A carbohydrate ingredient with a gel-like texture, it functions as a binding agent and texture enhancer.",Hydration
Sodium Cetearyl Sulfate,GOOD,A mixture of stearyl and cetyl sulfate that funtions as a surfactant.,
Sodium Citrate,GOOD,"This workhorse ingredient helps control the pH of skin care products, making it valuable in exfoliants, cleansers, and toners. It also has antioxidant, chelating and preservative properties, and is used in both food and medical applications.",
Sodium Cocoamphoacetate,GOOD,Functions as a cleansing agent and can also have mild conditioning properties.,
Sodium Cocoyl Amino Acids,GOOD,This mild cleansing agent can also work with other ingredients to condition and help replenish skin and hair.,
Sodium Cocoyl Glutamate,GOOD,This mild cleansing agent is derived from coconut and the amino acid glutamic acid. It is considered non-irritating as used in skin care products.,
Sodium Cocoyl Glycinate,GOOD,"This amino acid-derived cleansing agent is considered to be mild, non-drying, and non-irritating.",
Sodium Cocoyl Isethionate,GOOD,"Mild cleansing agent derived from coconut, known to mitigate disruption of skin’s barrier. Provides gentle foaming action.",
Sodium Dehydroacetate,GOOD,An organic salt used in low amounts as a preservative to prevent formulary spoilage.,
Sodium Dextran Sulfate,GOOD,This salt-derived suspending agent has been ruled safe as used in cosmetics.,
Sodium Dilauramidoglutamide Lysine,GOOD,"Plant-derived ingredient that helps skin rejuvenate, while also functioning as a surfactant and emulsifier to keep the formula from separating. Its ceramide-like structure has a high affinity for skin.",Hydration
Sodium Gluconate,GOOD,"This synthetically derived ingredient binds to metal ions to increase the stability of skin care formulas. It also serves as a humectant, meaning it helps skin retain moisture.",Hydration
Sodium Glycolate,GOOD,Buffering ingredient that helps to balance the pH of a formula.,
Sodium Hexametaphosphate,GOOD,"Salt with multiple functions in cosmetics. It can act as a detergent, an emulsifier, a texturizer,...",
Sodium Lactate,GOOD,"The sodium salt of lactic acid, which works as a hydrating and buffering agent (to adjust a product’s pH value). It also offers antioxidant properties as a secondary benefit.",Hydration
Sodium Laureth-13 Carboxylate,GOOD,Used primarily as a detergent cleansing agent.,
Sodium Laureth Sulfate,GOOD,"Commonly known as SLES, this safe, gentle, widely used cleansing agent is known for its lathering/foaming effects. Can be derived from coconut.",
Sodium Lauroamphoacetate,GOOD,Gentle cleansing agent which is often used to formulate cleansers for babies. It also helps boost foam production in all types of face and body washes.,
Sodium Lauroyl Glutamate,GOOD,"Contributes skin-softening and cleansing benefits to skin. Composed of sodium, glutamic acid (an amino acid) and lauric acid (a fatty acid).",
Sodium Lauroyl Lactylate,GOOD,"Naturally derived ingredient which functions as an emulsifier, thickener, and surfactant in skin care products. It has been ruled safe as used in cosmetics.",
Sodium Lauroyl Methyl Isethionate,GOOD,Naturally-derived cleansing agent that is noted in research for its gentleness on skin.,
Sodium Lauroyl Sarcosinate,GOOD,"Gentle surfactant (cleansing agent) that helps remove oil, makeup and other facial debris.",
Sodium Lauryl Glucose Carboxylate,GOOD,A gentle cleansing agent that may be derived from coconut or made synthetically. Often used to improve the sensorial effects.,
Sodium Laurylglucosides Hydroxypropylsulfonate,GOOD,This mild cleansing agent is considered much gentler than sodium lauryl sulfate and often used with other mild surfactants to produce cleansers for sensitive skin.,
Sodium Levulinate,GOOD,"This is the salt form of the organic compound levulinic acid, which softens and conditions skin; it can also be used as a cosmetics preservative.",Hydration
Sodium Methyl Cocoyl Taurate,GOOD,Mild surfactant derived from coconut; often used in cleansers when the desired effect is a creamy foam.,
Sodium Methyl Oleoyl Taurate,GOOD,Gentle cleansing agent that helps build the viscosity and foaming properties of cosmetic formulas such as facial and body washes.,
Sodium Methyl Taurate,GOOD,Mild surfactant often combined with...,
Sodium Myreth Sulfate,GOOD,Detergent cleansing agent similar to sodium laureth sulfate or ammonium laureth sulfate...,
Sodium Myristoyl Sarcosinate,GOOD,"This salt functions as a hair conditioning ingredient, emollient, and cleansing agent in cosmetics.",
Sodium Palmitoyl Sarcosinate,GOOD,"Sodium palmitoyl sarcosinate is the salt of palmitoyl sarcosinate, which is derived from the amino acid derivative sarcosine.",Hydration
Sodium PEG-7 Olive Oil Carboxylate,GOOD,A mild surfactant formed by reacting fatty acids from olive oil esters with polyethylene glycol (PEG).,Hydration
Sodium Phytate,GOOD,Synthetic salt form of the antioxidant phytic acid. Acts as a stabilizer and chelating agent to keep metals such as iron and copper from binding to water in the formula.,
Sodium Polyacrylate,GOOD,"Has multiple uses in cosmetics as a film-forming agent, emulsion stabilizer, thickener, and absorbent. It can absorb 100–1000 times its mass in water.",Oil Control
Sodium Polyacrylate Starch,GOOD,Sodium polyacrylate starch is a mixture of a natural starch combined with a synthetic acrylate polymer.,Oil Control
Sodium RNA,GOOD,Limited research shows this derivative of ribonucleic acid has skin conditioning and antioxidant properties.,Anti-Aging
Sodium Stearoyl Glutamate,GOOD,"Amino acid-derived cleansing agent with emulsifying properties that contribute to softer, smoother skin. May be synthetic or animal-derived.",Hydration
Sodium Stearoyl Lactylate,GOOD,"Stabilizes the water phase of formulas that contain hydrating ingredients. Works via its interaction with proteins and starches, where it can also help modify a product’s texture.",
Sodium Succinate,GOOD,This salt of succinic acid is used as a buffering agent and pH adjuster in cosmetics.,
Sodium Trideceth Sulfate,GOOD,This mild cleansing agent helps water mix with oil and dirt so it can be rinsed away.,
Solanum Melongena Fruit Extract,GOOD,Extract from the fruit portion of solanum melongena (eggplant) that contains antioxidant properties and potential anti-aging benefits.,Anti-Aging
Solanum Tuberosum Extract,GOOD,Extract that is more commonly known as potato starch. Used as a thickening agent and texture enhancer in cosmetics.,Hydration
Solidago Virgaurea (Goldenrod) Extract,GOOD,This extract from a plant also called the European goldenrod has antioxidant and potentially antimicrobial benefits for skin.,Anti-Aging
Solvent,GOOD,"Describes a large group of ingredients, including water, that are used to dissolve or break down other ingredients, such as gases or solids, to form a solution.",
Sonojell,GOOD,Trade name for petrolatum.,"Hydration, Soothing"
Sophora Angustifolia Root Extract,GOOD,This root extract’s antioxidant properties  might be able to fight the causes of dark spots and discolorations.,"Anti-Aging, Dark Spot Fading"
Sorbeth-230 Tetraoleate,GOOD,Sugar- and fatty acid-derived cleansing agent that aids in formula stability mostly due to its emulsification properties.,
Sorbeth-30 Tetraoleate,GOOD,This surfactant and emulsifying agent is often used in oil-based cleansers.,
Sorbic Acid,GOOD,"A preservative that can be naturally derived or made synthetically. It prevents the growth of bacteria, mold, and fungi and is considered safe as used in cosmetics.",
Sorbitan Isostearate,GOOD,A very mild cleansing agent that also helps stabilize skin care formulas and keep oil- and water-based ingredients from separating.,
Sorbitan Laurate,GOOD,Cleansing agent/emulsifier used to enhance the overall texture of the formula.,
Sorbitan Oleate,GOOD,A synthetic or animal-derived ingredient used as an emulsifier and cleansing agent in cosmetics. Considered safe as used in cosmetics.,
Sorbitan Olivate,GOOD,Sorbitan olivate is a mixture of the fatty acids from olive oil plus a sugar known as sorbitol.,
Sorbitan Sesquioleate,GOOD,Functions as an emulsifier and formulary texture enhancer.,
Sorbitan Stearate,GOOD,Emulisifier/thickener that enhances the texture and stabilizes the formula.,
Sorbitan Tristearate,GOOD,This derivative of sorbitol functions as a surfactant and emulsifier in skin care products.,
Spirulina,GOOD,Research shows this type of blue-green algae has potent antioxidant and potential calming abilities.,"Anti-Aging, Soothing"
Spirulina Maxima Extract,GOOD,Research shows this type of blue-green algae has potent antioxidant and potential calming abilities.,"Anti-Aging, Soothing"
Steapyrium Chloride,GOOD,Antistatic agent used in hair-care products.,
Stearalkonium Chloride,GOOD,Antistatic ingredient used in hair-care products to control flyaways and aid in helping a brush or comb get through hair.,
Stearalkonium Hectorite,GOOD,A powder derived from hectorite clay which is used in amounts up to 50% as a safe suspending agent in cosmetics.,
Stearamidopropyl Dimethylamine,GOOD,Can be used as an emulsifier and surfactant (cleansing agent). Popular in hair care where it is praised for delivering antistatic/conditioning properties.,
Stearates,GOOD,These compounds are either salts or esters of the fatty acid stearic acid.,Hydration
Steareth-2,GOOD,Fatty alcohol-derived emulsifier that helps water & oil-based ingredients stay mixed in both water- and oil-based solutions.,
Steareth-20,GOOD,"Fatty alcohol-derived surfactant, emulsifier, and stabilizing ingredient that’s been ruled safe as it is used in cosmetics.",
Steareth-21,GOOD,"Fatty alcohol-derived surfactant, emulsifier, and stabilizing ingredient that’s been ruled safe as it is used in cosmetics.",
Stearic Acid,GOOD,"Emollient, emulsifier, cleansing and texture-enhancing ingredient. Protects skin's surface against water loss and helps shore up skin's protective barrier.",Hydration
Stearyl Alcohol,GOOD,Gentle multi-tasking fatty alcohol that acts as a moisturizer and cleansing agent in skin care and helps keep other ingredients intact in a formulation. It has been ruled safe as used in cosmetics,
Stearyl Dimethicone,GOOD,Synthetic skin-conditioning agent that's a siloxane polymer. It adds opacity and a silky feel to cosmetic products.,
Stearyl Methicone,GOOD,Silicone polymer used as a skin-conditioning or occlusive agent.,Hydration
Stearyl Stearate,GOOD,A plant-based wax prepared with natural fatty acids combined with synthetic fatty alcohols.,
Styrene/Acrylates Copolymer,GOOD,Synthetic polymer.,
Succinic Acid,GOOD,"Succinic acid is a synthetic acid that helps adjust a product’s pH, offsets unpleasant odors and is produced by substances in skin’s microbiome.","Soothing, Anti-Acne"
Sucrose,GOOD,Monosaccharide that has hydrating properties for skin.,Hydration
Sucrose Cocoate,GOOD,"Versatile, gentle, coconut-derived cleansing agent, foam booster, texture enhancer, and emollient used in both rinse-off and leave-on products.",
Sucrose Laurate,GOOD,Created from a combination of sugar and coconut-derived lauric acid; functions as an emollient/skin-conditioning agent and emulsifier/gentle cleansing agent.,Hydration
Sucrose Stearate,GOOD,Sucrose stearate is an ester of stearic acid and sugar that works as an emollient and cleansing agent.,Hydration
Sulfates,GOOD,"In cosmetics, this large group of ingredients is used mainly as a cleansing agent; they include sodium lauryl sulfate and sodium laureth sulfate.",
Surfactant,GOOD,"Shortened term for surface active agent. Surfactants degrease and emulsify oils and fats and suspend soil, allowing them to be washed away.",
Sweet Almond,GOOD,"Most often used in its oil form, this ingredient is expressed from almonds. Also used as an extract, protein, powder, and various forms that utilize fatty acids from almond oil.","Anti-Aging, Hydration"
Symphytum Officinale Callus Culture Extract,GOOD,This stem cell extract from the comfrey plant has antioxidant and soothing properties.,Anti-Aging
Synthetic Beeswax,GOOD,An artificial form of beeswax composed of a mixture of alcohol esters.,
Synthetic Fluorophlogopite,GOOD,Synthetic fluorophlogopite is a synthetic mineral material used in cosmetics to add bulk and to thicken emulsions.,
Synthetic Fluorphlogopite,GOOD,This synthetic mineral material is used in cosmetics to add bulk and to thicken emulsions.,
Synthetic Wax,GOOD,A wax derived from a mixture of various oils. It functions as a binding and stabilizing agent.,
Tamanu Oil,GOOD,"Like most oils, this is composed of phospholipids and glycolipids, and these are natural constituents of healthy-looking skin and are good hydrating agents.","Hydration, Anti-Aging"
Tamarindus Indica Seed Gum,GOOD,Unknown,Hydration
Tapioca Starch,GOOD,A natural thickener and texture enhancer derived from the roots of Manihot...,Oil Control
Tasmannia Lanceolata Fruit/Leaf Extract,GOOD,"This plant’s fruit and leaves are rich in antioxidants, which have soothing benefits and can help neutralize the visible effects of environmental stressors. Although this plant contains fragrance chemicals, it’s not overly concerning in this extract form (especially if the concentration is low enough that you cannot detect the peppery scent).",Anti-Aging
Tetradibutyl Pentaerithrityl Hydroxyhydrocinnamate,GOOD,"Serves a variety of functions in cosmetic formulations, including antioxidant, formulary stabilizer, and preservative.",
Tetrahydroxypropyl Ethylenediamine,GOOD,"Chelating agent that binds with metal ions or metallic compounds, preventing them from adhering to a surface (such as skin, hair, or clothing) or causing contamination, such as in the case of trace amounts of iron.",
Tetrasodium EDTA,GOOD,"This ingredient is one of the salt forms of EDTA, which is short for ethylenediamine tetraacetic acid. EDTA helps stabilize cosmetics formulas, preventing ingredients from binding to trace elements (often minerals) found in water.",
Tetrasodium Etidronate,GOOD,Used as a chelating agent in cosmetics to prevent varying mineral components from binding together and negatively affecting the formulation.,
Tetrasodium Glutamate Diacetate,GOOD,"A safe synthetic chelating agent with natural origins. Used in amounts up to 1% to boost the effectiveness of preservatives, allowing for the use of lower amounts than is typical without compromising effectiveness.",
Thickening Agent,GOOD,"Substances that can have a soft to hard wax-like texture or a creamy, emollient feel, and that can be great lubricants.",
Thiotaurine,GOOD,Amino acid that has potential antioxidant properties for skin.,"Anti-Aging, Hydration"
Threonine,GOOD,"An essential amino acid known to do more in the body than on skin, with its benefit for skin mostly being about hydration and promoting firmer skin","Anti-Aging, Hydration"
Tin Oxide,GOOD,Mineral-derived ingredient that is most often used to lend opacity to a formula. Can also function as a bulking agent.,
Tragacanth,GOOD,Natural gum used as a thickener in cosmetics.,
Trehalose,GOOD,Humectant plant sugar that boosts skin’s hydration and offers antioxidant properties to help preserve youthfulness.,Hydration
Triacetin,GOOD,Solvent used in skin care to help form consistent solutions. Can also assist in preserving and enhancing product texture.,
Tribehenin,GOOD,This mix of glycerin and behenic acid conditions skin and has been deemed non-irritating and safe as used in cosmetics.,Hydration
Tribehenin PEG-20 Esters,GOOD,"Works as an emollient, surfactant, and emulsifier.",Hydration
Tricaprylin,GOOD,Mixture of glycerin and caprylic acid. Has emollient properties and is used as a skin-softening agent.,Hydration
Tridecane,GOOD,"Emollient that is used to create lightweight, smooth glide formula bases, touted for its quick absorbency and non-greasy finish. Can be derived from okra and other natural sources.",
Trideceth-12,GOOD,Trideceth-12 is a synthetic mixture of a fatty alcohol (tridecyl alcohol) and polyethylene glycol that functions as an emulsifier and cleansing agent.,
Trideceth-6,GOOD,"An emulsifier, meaning it helps keep unlike ingredients (such as oil and water) from separating in an emulsion.",
Tridecyl Salicylate,GOOD,Synthetic ingredient that functions as a skin-softening agent.,Hydration
Tridecyl Stearate,GOOD,Skin-softening emollient known for its quick absorbance and velvety after feel. Also works as a thickening agent and formulary texture enhancer.,Hydration
Tridecyl Trimellitate,GOOD,"Emollient, film-forming agent, and texture-enhancing ingredient. Leaves skin feeling soft and conditioned.",Hydration
Triethoxycaprylylsilane,GOOD,Silicone that functions as a binding agent and emulsion stabilizer. Often used to coat mineral sunscreen actives to improve aesthetics; can also help reduce oxidative stress.,
Triethoxycaprylylsilane Crosspolymer,GOOD,A silicone polymer used to enhance a product's texture.,
Triethoxysilylethyl Polydimethylsiloxyethyl Hexyl Dimethicone,GOOD,"A silicone polymer that has multiple functions in cosmetic products, including skin and hair softening and as a texture enhancer.",Hydration
Triethylhexanoin,GOOD,"This mixture of glycerin and the fatty acid 2-ethylhexanoic acid works as a solvent, occlusive agent, and conditioning ingredient in cosmetics. It is considered safe as used in skin care products.",Hydration
Triglyceride,GOOD,Used as an emollient and thickening agent in cosmetics.,Hydration
Trigonella Foenum-Graecum Seed Extract,GOOD,"Latin name for the fenugreek plant. The seeds are used most often, and their fiber content helps...",Hydration
Triheptanoin,GOOD,"Sometimes used as a substitute for silicones, triheptanoin is an ester made from glycerin and an oily liquid known as heptanoic acid. Its emollient properties smooth and soften skin.",Hydration
Trihydroxystearin,GOOD,"A mix of glycerin and castor oil-derived fatty acid, this ingredient is used as an occlusive and texture-enhancing agent.",Hydration
Triisocetyl Citrate,GOOD,A blend of the fatty alcohol isocetyl alcohol and citric acid. It is used as on occlusive agent.,Hydration
Triisostearin,GOOD,"Helps improve product texture by adding a cushiony feel and smooth application that sets to a hydrated, glossy finish.",
Trilaurin,GOOD,Used as thickening agent and emollient.,Hydration
Trimethylsiloxysilicate,GOOD,Used as a skin-softening and occlusive agent.,Hydration
Trioclanolin,GOOD,"Derived from lanolin and used as a texture enhancer, most commonly in powder-based products such as eyeshadows and powder blush where it works to help make application smoother and more even.",Hydration
Trioctanoin,GOOD,Used as an emollient and thickening agent in cosmetics.,Hydration
Trioctyldodecyl Citrate,GOOD,Mixture of octyldodecanol and citric acid used as a skin-softening agent and emollient.,Hydration
Tripeptide-32,GOOD,"A synthetic peptide with the ""tri"" (meaning three) designation referring to this peptide's mix of the amino acids proline, serine, and threonine.","Anti-Aging, Hydration"
Tripleurospermum Maritimum Extract,GOOD,"Also known as false mayweed or sea mayweed, this plant extract encompasses the entire plant.","Anti-Aging, Soothing, Hydration"
Trisiloxane,GOOD,Skin conditioning ingredient that also helps formulas to spread evenly and dry quickly.,Hydration
Trisodium EDTA,GOOD,"Used as a water-softening and chelating agent (a compound that binds and separates metals, keeping them from bonding to other ingredients).",
Trisodium Ethylenediamine Disuccinate,GOOD,"Chelating agent that plays a pivotal role in the overall stability, aesthetics, and efficacy of the formulation.",
Triticum Aestivum Leaf Powder,GOOD,Plant-derived powder that has possible antioxidant and anti-aging benefits,Anti-Aging
Triticum Vulgare (Wheat) Germ Extract,GOOD,Functions as a skin-softening and hair-conditioning agent.,"Hydration, Anti-Aging"
Triticum Vulgare (Wheat) Protein,GOOD,Functions as a skin-softening and hair-conditioning agent.,Hydration
Triticum Vulgare Germ Oil,GOOD,Non-fragrant plant oil that imparts emollience and delivers beneficial compounds including skin-replenishing squalane.,"Hydration, Anti-Aging"
Tropolone,GOOD,This organic compound is used in cosmetics as a preservative due to its antimicrobial properties.,
Tryptophan,GOOD,Amino acid that offers potential hydration and antioxidant properties for skin.,Hydration
Ulmus Davidiana Root Extract,GOOD,"Plant extract that contains polysaccharides and potent antioxidants. Helps soothe, hydrate and reduce signs of aging.","Anti-Aging, Hydration, Soothing"
Uncaria Tomentosa Extract,GOOD,"Also known as cat's claw, there is some research showing it to be an effective skin-soothing antioxidant.",Soothing
Undecane,GOOD,"Undecane is an emollient that is used to create lightweight, smooth glide formula bases for skin care/makeup products. Learn more at Paula’s Choice.",
VA/Crotonates Copolymer,GOOD,This synthetic polymer is used a a film-forming agent in cosmetics preparations.,
Valine,GOOD,This essential amino acid helps soothe skin and improve hydration. It works with other amino acids to improve skin and bodily health.,"Hydration, Soothing"
Vanilla Planifolia Fruit Extract,GOOD,"A naturally derived ingredient well known for its antioxidant and skin soothing benefits. Its flavor component, which is considered non-sensitizing, is also used as an additive in food and lip products.","Anti-Aging, Soothing"
Vinyl Dimethicone/Methicone Silsesquioxane Crosspolymer,GOOD,This blend of silicone polymers works as a texture enhancer and thickener and has been ruled safe as it’s used in cosmetics.,
Vitamin B12,GOOD,Overall there is limited research showing vitamin B12 has any benefit when applied topically on skin,Anti-Aging
Vitamin D,GOOD,"A fat-soluble vitamin that may have antioxidant and skin-soothing benefits for skin, among other beneficial traits.",Anti-Aging
Vitamin K,GOOD,"Technically known as phytonadione, vitamin K is a fat-soluble vitamin. Applying vitamin K to the surface of the skin won't improve the look of unevenness or dark circles.","Anti-Aging, Evens Skin Tone"
Vitis Vinifera Fruit Water,GOOD,Skin-conditioning aqueous solution obtained from grapes.,Hydration
VP/Eicosene Copolymer,GOOD,"Viscosity-increasing agent and film former, often used to help sunscreen formulations adhere better to skin.",
VP/Hexadecene Copolymer,GOOD,Synthetic polymer.,
VP/VA Copolymer,GOOD,A synthetic polymer used in skin and hair care primarily as a film-forming agent.,
Walnut Oil,GOOD,"Emollient, non-fragrant plant oil.",Hydration
Water,GOOD,"This is the most widely used ingredient in skin care, often appearing first in product ingredient lists. Used as a solvent.",Hydration
Watercress Extract,GOOD,"Research indicates that watercress extracts can have antioxidant activity, but that information is limited.",Anti-Aging
Wheat Amino Acids,GOOD,A blend of amino acids from wheat protein after it has been broken down via hydrolysis.,"Hydration, Anti-Aging"
Wheat Germ Glycerides,GOOD,Used as emollient and texture enhancer in cosmetics.,"Hydration, Anti-Aging"
Wheat Germ Oil,GOOD,Emollient plant oil similar to all non-fragrant plant oils.,"Hydration, Anti-Aging"
Wheat Protein,GOOD,Functions as a skin-softening and hair-conditioning agent.,Hydration
Whey Protein,GOOD,A form of protein derived from milk that functions as a skin-softening and/or hair-conditioning agent. Whey protein also shows promise for enhancing skin's extracellular matrix.,Hydration
White Willow,GOOD,"Plant extract that offers proven skin-soothing, antioxidant benefits.",Soothing
Willow Bark,GOOD,"Plant extract that offers proven skin-soothing, antioxidant benefits.",Soothing
Xanthan Gum,GOOD,"This naturally derived ingredient is produced from the fermentation of simple sugars, and acts as a thickening agent, texture enhancer, and emulsion stabilizer in cosmetics.",
Ximenia Americana Oil,GOOD,Latin name for plum oil; it can have emollient properties.,"Anti-Aging, Hydration"
Xylitylglucoside,GOOD,"An ingredient derived from two water-binding plant sugars, xylitol and glucose.","Hydration, Soothing"
Xylose,GOOD,"Form of sugar. Similar to other sugars, xylose has hydrating properties for skin.","Hydration, Soothing"
Xymenynic Acid,GOOD,Synthetic fatty acid that functions as a skin-softening agent.,Hydration
Yeast,GOOD,"Group of fungi that ferment sugars. Yeast is a source of beta-glucan, which is a good antioxidant.","Anti-Aging, Hydration, Soothing"
Zea Mays Corn Starch,GOOD,"Starch obtained from corn that can be formulated to serve a variety of roles, including working as an absorbent, viscosity increaser, film-forming agent, skin protectant or abrasive agent.",Oil Control
Zinc Gluconate,GOOD,Zinc gluconate is the zinc salt of gluconic acid produced from glucose that functions as a preservative.,Hydration
Zinc Pyrithione,GOOD,Cosmetic preservative and United States-recognized over-the-counter drug popular in anti-dandruff shampoos as well as other personal care products.,
Zinc Stearate,GOOD,The zinc salt of stearic acid.,
Zizyphus Jujuba Fruit Extract,GOOD,Plant extract that delivers soothing properties and may also provide other benefits for skin.,Anti-Aging
Sorbitan Palmitate,GOOD,"The primary role of this sugar- and palm-derived ingredient is emulsifier, helping to keep the oil and water phases of cosmetics from separating.",
